restaurant,review_id,date,stay_date,user,badge,rating,title,review
Kampachi Plaza33,780278536,2020-12-31 00:00:00,December 2020,soeniasingam2020,1 review,5,great food and service,great food and service. customer service was excellent. great ambience. SOPs were adhered to. flexible with reservations.
Kampachi Plaza33,780275168,2020-12-31 00:00:00,December 2020,Roundy88,2 reviews,5,Good food and good service,The team at Kampachi is very professional and friendly. Handled our orders and requests well. We have a good dinner experience. Food choice is excellent.
Kampachi Plaza33,780274717,2020-12-31 00:00:00,December 2020,Llcje,1 review,5,Family dinner,"Came for the new year eve dinner, very nice food, excellent services, friendly staffs! The kids loved the food, we have great dining experience, thanks!"
Kampachi Plaza33,780188534,2020-12-30 00:00:00,December 2020,HanafiN22,4 reviews,4,Fantastic service & good food,"Overall staff is friendly especially Mr. Ifzan & Mr.Zahier, fantastic service of food which is they asked if all the food is served."
Kampachi Plaza33,780009602,2020-12-27 00:00:00,December 2020,30102020jessiec,2 reviews,5,Fantastic! Good attention! ,"Very observant manager Jenny in the midst. She was really alert and concerned... came forward to ensure that my food was satisfactory and took action to rectify immediately to guarantee that I ended up a blessed diner. 

Cheers to Kampachi!"
Kampachi Plaza33,779996559,2020-12-27 00:00:00,December 2020,szening,3 reviews,5,Great value and service,Second time here. Good food for a reasonable price and very attentive service. Looking forward to the next visit.
Kampachi Plaza33,779995786,2020-12-27 00:00:00,December 2020,adriantan2323,1 review,5,Sunday Brunch Buffet,Very good spread of food. I like the beef tepanyaki and abekawamochi. Fantastic and delicious. Will come again
Kampachi Plaza33,779995770,2020-12-27 00:00:00,December 2020,SeanN975,4 reviews,5,"Great buffet lunch, awesome service",Very attentive service and food overall was very good. Peanut mochi was the best. Teppanyaki was excellent with very tender wagyu pieces and prawns were juicy.  Sashimi & sushi was very fresh. Also loved the deep fried oysters. Tempura was a bit overcooked and shishamo...
Kampachi Plaza33,779957232,2020-12-26 00:00:00,December 2020,Culture662959,1 review,5,Nice food nice environment,Nice food and nice environment. Sashimi is very fresh. Staff here is very friendly. Recommend and Will visit again.
Kampachi Plaza33,779946636,2020-12-26 00:00:00,December 2020,362munl,2 reviews,5,Good,The food is good. Fresh ingredients from japan. Strak fish fruits hotpot starters all are good. Impressive
Kampachi Plaza33,779912232,2020-12-25 00:00:00,December 2020,vsuyin,10 reviews,5,"Great service, attentive staff","Great service, attentive staff and fresh fish. Good dinner experience thanks to the staff and the restaurant manager Jenny. Thank you!"
Kampachi Plaza33,779912109,2020-12-25 00:00:00,December 2020,Sooyuen123,1 review,5,Christmas Dinner,We like the seasonal fish recommended by jenny. Thanks for your hospitality. My kid love garlic rice is a best. Wonderful dinner.
Kampachi Plaza33,779912039,2020-12-25 00:00:00,December 2020,JessChin2,1 review,5,Christmas Day & Birthday Celebration,Thank you to Miss Jenny Ong and team for the wonderful service. Each and everyone of them is so friendly proactive. Food is good and fresh of course!  Thank you for making our Christmas Day a memorable one 😊
Kampachi Plaza33,779911911,2020-12-25 00:00:00,December 2020,cyh_justin,1 review,5,Birthday and Christmas Celebration,"Jenny Ong and team are excellent! Cozy and peaceful environment, and most importantly workers there are so hospitable! Food is good too, would definitely come back again!"
Kampachi Plaza33,779910375,2020-12-25 00:00:00,December 2020,Karenng92,1 review,5,"Cozy environment, good ambience","Excellent service, friendly staff!
Manager, Jenny and all the waitress are down to earth. Had a wonderful dinner with my friend here. Will pay another visit here for sure."
Kampachi Plaza33,779904609,2020-12-25 00:00:00,December 2020,Jpngyang,1 review,5,Christmas Lunch Buffet at Kampachi,"Good food, excellent service, with special and most sincere thanks to Jenny for making this Christmas buffet/lunch for our family possible."
Kampachi Plaza33,779870237,2020-12-24 00:00:00,December 2020,Songjude,1 review,4,Mr Song,Excellent service. Good food and fine ambience. Staffs are friendly and helpful. Very good experience
Kampachi Plaza33,779744447,2020-12-22 00:00:00,December 2020,BackPacker612724,1 review,5,Nice environment,"Delicious food and great hospitality. Easy to park, easy to find location, nice and cozy environment. Romantic music."
Kampachi Plaza33,779744256,2020-12-22 00:00:00,December 2020,OnaAnuar,2 reviews,5,Cosy & superb menu!,"The staff are so friendly, nice ambience and good good! Couldn't ask more when u get together with friends..
The Maki is soooo delicious and fresh!"
Kampachi Plaza33,779535552,2020-12-19 00:00:00,December 2020,cjeesan,4 reviews,5,Friendly & attentive service,Second time here. Food is good as always. The price is very reasonable for the Japanese food buffet menu. Very attentive staff.
Kampachi Plaza33,779497591,2020-12-18 00:00:00,December 2020,emirzn,1 review,4,Will come again!,Food and service was good! Unagi is from Taiwan but excellent. Wagyu melted in the mouth like butter.
Kampachi Plaza33,779436980,2020-12-17 00:00:00,December 2020,jujudinggg,1 review,5,Lovely!,"Just had my birthday dinner over here and wow, food was absolutely amazing and the service was top notch! Hana was the one serving us and I must say she was very helpful and friendly. Loved the dining experience. Keep up the good work, kampachi!..."
Kampachi Plaza33,779297047,2020-12-16 00:00:00,December 2020,KimTravels9,1 review,5,Dinner at Kampachi,"Had a great time with my family here for dinner. Food was good, and excellent service by the floor staff and the restaurant manager Jenny."
Kampachi Plaza33,779238185,2020-12-15 00:00:00,December 2020,Stannie2014,1 review,5,Excellent food and excellent service,"Fresh and tasty Japanese food. Excellent service 👍  Kampachi offer buffet lunch on weekend.  Japanese food lover may enjoy the fresh food especially Tepanyaki Prawn and Beef. 

Improve air conditioning will be a plus point to the restaurant."
Kampachi Plaza33,779188768,2020-12-14 00:00:00,December 2020,SamanthaLee88,11 reviews,5,Excellent service and good quality of food! ,"Excellent service and good quality of food! 
Staff are well trained on up selling live seafood of the day."
Kampachi Plaza33,779096233,2020-12-13 00:00:00,December 2020,NickAng88,1 review,4,Good fresh Japanese Food,"Good fresh food with mostly attentive waiters. Price was maybe on the higher side but ok, I'd be more than happy to return"
Kampachi Plaza33,779096116,2020-12-13 00:00:00,December 2020,michael_tan2003,2 reviews,5,food,"good food and friendly waiters :) especially edward
as he was friendly and helpful throughout the meal :)"
Kampachi Plaza33,779033892,2020-12-12 00:00:00,December 2020,NickSlick91,1 review,5,Lunch was good,Came here for lunch on a Saturday. Sashimi was fresh and thick. Food was excellent and the service was on point. Well worth it for the price. Our server Hana was always there to make sure everything was going alright. Would recommend.
Kampachi Plaza33,779030903,2020-12-12 00:00:00,December 2020,Joyyn97,1 review,5,Loving here,"Service was quite slow but the waitress serving us, Chrstina was so nice and patient with our orders."
Kampachi Plaza33,778968406,2020-12-11 00:00:00,December 2020,Foodloverlian,1 review,5,Great food with good staffs,A lovely restaurant to have an enjoyable lunch with enormous portions. The salmon sashimi happened to be very fresh. Overall friendly staffs & i certainly had a great time here.
Kampachi Plaza33,778545270,2020-12-06 00:00:00,December 2020,Nglayhua,1 review,5,-,"Amazing food. We visited on a buffet day, and we ate as much as we liked. The service was great and the people were friendly."
Kampachi Plaza33,778545246,2020-12-06 00:00:00,December 2020,LeonhartM,1 review,4,Kampachi Feedback,"Service ok, great service by Jenny
Food ok ok
Oyster if more fresh will be good
Other Japanese food is fine
Desert ok"
Kampachi Plaza33,778545242,2020-12-06 00:00:00,December 2020,Fishie929,1 review,4,"Good service, average food","Service on point, food quality has room of improvement. Seafood freshness should be taken care of. So far so good."
Kampachi Plaza33,778538812,2020-12-06 00:00:00,December 2020,Beingyaya,1 review,5,best japanese food in town,Best place to eat Japanese food. Also good ambience. Special thanks to Ifzan and Rohana. Keep up the good work!
Kampachi Plaza33,778491477,2020-12-05 00:00:00,December 2020,butterflysting,2 reviews,5,"Great food, even better service :)",Our family always leaves here satisfied! The food quality is consistently fresh and good.. The team including Jenny (manager) are very friendly and attentive too. Would highly recommend!
Kampachi Plaza33,778472046,2020-12-05 00:00:00,December 2020,Li Hui L,3 reviews,5,Good Food w Good Service,"I ordered the sushi buffet and it’s quite nice! Won’t say it’s amazing but it’s totally good value. RM168 for LOTS of choices, including sashimi, teppanyaki, uramaki etc. The service is good too. (Thanks April!😊) 
Review from @foodandlihui (on IG!)"
Kampachi Plaza33,778425815,2020-12-04 00:00:00,December 2020,Uri A,2 reviews,5,Food and Service was amazing - thank you April.,A friend referred - the dinner was splendid and April the hostess was amazing and super friendly. Definitely will come again.
Kampachi Plaza33,778425156,2020-12-04 00:00:00,December 2020,chenggini,1 review,5,nice food at reasonable price,friendly staff serving (christina). we will come again soon. jingle bell jingle bell jingle all the way
Kampachi Plaza33,778184761,2020-11-30 00:00:00,November 2020,Marissa_Rahman,1 review,5,Never disappoints,Excellent food and attentive service as always. A great place for fuss free and non-nonsense japanese food.
Kampachi Plaza33,778117956,2020-11-29 00:00:00,November 2020,Deidl72,1 review,5,My Husband’s Birthday Celebration,"It was a wonderful first time experience having lunch buffet at Kampachi, Jaya 33 PJ. Great food and ambiance with accommodating staffs. We would like to thank Ms Jenny and Christina for your great assistance. Thank you Kampachi for hiring key staffs like them. We..."
Kampachi Plaza33,778107754,2020-11-29 00:00:00,November 2020,pqoworjf,1 review,4,mr chen,"great service, great food, and a great place to dine at altogether. highly recommended, and if you’re ever craving japanese food, dine here"
Kampachi Plaza33,777871354,2020-11-25 00:00:00,November 2020,LONNIE C,3 reviews,4,Awesome buffet lunch and customer experience at Kampachi Plaza 33,"Delicious buffet spread which was delivered to the table on Saturday.   Enjoyed the tasty and fresh sashimi, unagi, beef teppanyaki, and a wide variety of dishes.  Perfect ambiance for a quiet lunch.   Not forgetting the great service rendered by Jenny Ong.   Keep up the good..."
Kampachi Plaza33,777871062,2020-11-25 00:00:00,November 2020,Anwinz_77,1 review,5,Celebrate birthday dinner,Birthday dinner celebrations with hubby and friends after work from Subang Jaya and from Kuala Lumpur
Kampachi Plaza33,777661289,2020-11-22 00:00:00,November 2020,jackyet2017,16 reviews,5,Lovely brunch,"Enjoyed the experience!! The sashimi, unagi, chawan mushi is awesome. Impeccable service and plan to visit again!"
Kampachi Plaza33,777208233,2020-11-15 00:00:00,November 2020,VasanthyRohan1,2 reviews,4,Trip to Kampachi Plaza 33,Great service and tasty dishes. Friendly staff and wide variety of dishes. Lovely ambience for special occasions.
Kampachi Plaza33,777132451,2020-11-14 00:00:00,November 2020,zee_thowei,2 reviews,5,Hearty lunch with a pleasant service,Celebrated our anniversary with our kids. The buffet lunch is now served ala carte to adhere to cmco SOP. The maguro and shake sashimi were well cut with balanced amount of fats. Beef teppanyaki was the star of the lunch. Our server April was attentative...
Kampachi Plaza33,776957279,2020-11-11 00:00:00,November 2020,MosesLauYewSoon,1 review,5,Our Anniversary Dinner,The service is great. Asked us whether how is our preference to serve the meal. They top up the green tea generously and it's hot. Shake aburi maki was delicious. Sushi is fresh. Beef teppanyaki is delicious. They surprised us with anniversary dessert! Great memories.
Kampachi Plaza33,776875726,2020-11-10 00:00:00,November 2020,C7233MYsharonl,2 reviews,5,Kampachi @ Jaya33,Had my lunch in Kampachi. Excellent service by staff Edward. Food are at best quality. Love the environment.
Kampachi Plaza33,776754428,2020-11-08 00:00:00,November 2020,adventurerisk,1 review,5,Japanese Buffet Lunch,"The Japanese Buffet was absolutely delicious! The choices were fantastic and the service top notch - especially Jenny, who took the time to make sure we were comfortable and happy (as well as the other staff who were equally as friendly). Highly recommended!"
Kampachi Plaza33,776729424,2020-11-08 00:00:00,November 2020,genieong,2 reviews,5,Wonderful brunch,Family of 9 went for their brunch buffet. Food was good but what stood out was their exceptional service - very attentive servers considering we had so many people. Jenny and her team made the dining experience here unforgettable. The environment is also cozy with...
Kampachi Plaza33,776649144,2020-11-07 00:00:00,November 2020,Ann889900,1 review,5,Kampachi Jaya 33,Good and marvellous service. Very attentive. Good variety of food. Food tasted excellent. Good for family.
Kampachi Plaza33,776647570,2020-11-07 00:00:00,November 2020,hungryygaijin,2 reviews,5,Good value brunch buffet.,Good value brunch buffet. CMCO compliant. Very good service - our tea were constantly refilled by the staffs.
Kampachi Plaza33,776175805,2020-11-01 00:00:00,November 2020,davidreview12,1 review,5,Good food,"Food and service were good. Would recommend the teppanyaki beef, teppanyaki prawn and grilled salmon head."
Kampachi Plaza33,775499748,2020-10-25 00:00:00,October 2020,howardhwy,4 reviews,5,Excellent Food and Service,Had dinner at Kampachi Plaza 33. Food quality was excellent especially the Sashimi cuts were very fresh and good in quality. Restaurant Manager Jenny and her team provided excellent service and good recommendations. Their Mochi dessert is truly out of this world. I would definitely...
Kampachi Plaza33,775495260,2020-10-25 00:00:00,October 2020,June8318,1 review,5,Awesome Food,Food was great and fresh. Service was good and staff are attentive. Love the unagi salmon sushi and sashimi.
Kampachi Plaza33,774476994,2020-10-16 00:00:00,October 2020,1080fullhd,1 review,5,Excellent service and food.,"The service is impeccable and the sashimi is fresh. Ms. Jenny Ong the manager, has many good recommendations. Thank you."
Kampachi Plaza33,774474957,2020-10-16 00:00:00,October 2020,Sarahsoh17,1 review,5,Food review,Really good soft shell carb sushi. The staff is really friendly. I really enjoyed my lunch over there.
Kampachi Plaza33,774149806,2020-10-13 00:00:00,October 2020,samW6326ZD,1 review,5,Kampachi food,The food and service is perfect! Love coming here. I love the staff at kampachi. They are really kind and attentive.
Kampachi Plaza33,773861868,2020-10-11 00:00:00,October 2020,enghwee82,1 review,5,Family Gathering,Nice and wonderful place with loads of delicious dishes that suited every age group. The environment also very nice and comfortable too.
Kampachi Plaza33,773732981,2020-10-10 00:00:00,October 2020,guateu,15 reviews,5,Excellent service!,"1st time for the weekend brunch and it was lovely time with family - slow eating, chatting, and just having fun discussing food - typical Malaysian conversations! Apparently we are the only (or few) families that mixes nuts into the ice cream.. It's yum!"
Kampachi Plaza33,773731057,2020-10-10 00:00:00,October 2020,alvinl800,10 reviews,5,Buffet is still awesome here!,"The food quality is really really good. Yes, the selection is not as vast as before but what counts is the quality. It’s a sit down and order buffet now obviously and that’s where the service but comes in. 
The service in this place is..."
Kampachi Plaza33,773044869,2020-10-04 00:00:00,October 2020,aarontan320,4 reviews,5,Birthday celebration,Great Service and experience. Our server Mirwan made us feel welcomed and was very attentive to what we needed. Would recommend this restaurant for celebrations and dates. Cozy ambiance. Will be back
Kampachi Plaza33,773036153,2020-10-04 00:00:00,October 2020,Atzw143,1 review,5,Fantastic food and service!,"Enjoyed my dinner.
Jenny the manager was so helpful and she recommended the weekend buffet, definitely will come again!"
Kampachi Plaza33,772999375,2020-10-04 00:00:00,October 2020,DeC_xvm,2 reviews,4,Great family place,"Food was good. Environment was comfortable, spacious place to have kids around. Staff were helpful and courteous."
Kampachi Plaza33,772998990,2020-10-04 00:00:00,October 2020,hanisibr,3 reviews,5,10/10,"Great ambience, good service, the food’s texture, taste and presentation are amazing. The staff (Marvin) is very friendly and helpful. Convenient location too! Would to recommend to a friend 🤗"
Kampachi Plaza33,772856776,2020-10-03 00:00:00,October 2020,Hanimahamd,2 reviews,5,Fresh seafood and great desserts,Had lunch with my family here. The food was great and service was excellent. Our server Mirwan was very friendly and attentive. He recommended good dishes. 10/10 would come again.
Kampachi Plaza33,772854804,2020-10-03 00:00:00,October 2020,Techtravel341,1 review,5,Good food and environment,"Good food & environment, Jenny’s recommendations are on point and ensure we enjoy our time here. The music might be slightly too loud"
Kampachi Plaza33,772182301,2020-09-28 00:00:00,September 2020,alaeddinn2015,6 reviews,5,We had a great business lunch,"We had a great business lunch 
Fantastic arrangements as usual by Mrs Jenny Ong she a great person 
For us the most important is the restaurant management and staff thanks again Jenny"
Kampachi Plaza33,772061710,2020-09-27 00:00:00,September 2020,T2149UBjosephl,2 reviews,5,Mr,"Overall food and service was good. Ordered wagyu, chicken teppanyaki, appetizer. Dessert serve was nice too"
Kampachi Plaza33,771155574,2020-09-20 00:00:00,September 2020,hurulz,5 reviews,5,Fantastic Service and Food! ,"Been here with my family since many many years and the service are GREAT as always especially by Mr Mirwan who have been attending us since we came here till now. 
The food is also always amazing. Love love everything in Kampachi! Keep up the..."
Kampachi Plaza33,771099588,2020-09-20 00:00:00,September 2020,danlee96,1 review,5,Great service + Food,Amazing food and service. Their buffet beef teppanyaki and maguro nigiri are some of the best for its price
Kampachi Plaza33,770966927,2020-09-19 00:00:00,September 2020,Foodhunter8765,2 reviews,5,Great Fugu Japanese Puffer Fish Dinner,"We found that we can get the authentic Fugu Japanese cuisine in Malaysia. We have make the reservation to try out the Fugu at Kampachi Plaza 33 by contacting the Manager Ms Jenny.

The dinner is fantastic with full fugu dishes from Appetizer till the..."
Kampachi Plaza33,770961666,2020-09-19 00:00:00,September 2020,Siehyin,1 review,5,Friendly service,Enjoy cosy place & quality food as specially buffet. Thank you Jenny for your hospitality. Having Wonderful time here
Kampachi Plaza33,770537616,2020-09-16 00:00:00,September 2020,missefie,2 reviews,5,The freshness of sashimi!,"I’m a regular customer for almost 15 years at a Japanese restaurant at one of the hotel in Kuala lumpur. But after i tried kampachi , i had the most fresh sashimi ever! Very thick cut of salmon belly sashimi. All the food and serving..."
Kampachi Plaza33,769937843,2020-09-12 00:00:00,September 2020,Surayarabs,1 review,3,Lunch buffet,Service was a bit slow but food was excellent. Can improve on the service and communication between workers. Overall satisfied
Kampachi Plaza33,768829444,2020-09-05 00:00:00,September 2020,Macha08,2 reviews,5,"Great food, excellent service ",Wonderful dining experience! The waiters are really attentive and helpful. Outstanding beef tepanyaki 😁 The green tea pudding is on another level
Kampachi Plaza33,768827499,2020-09-05 00:00:00,September 2020,JaniceWee121211,1 review,5,Lunchtime buffet,"Friendly staff and excellent food. Service good, good variety, clean environment and fresh foods. Especially the teppanyaki beef 🥩 highly recommended place 👍🏼."
Kampachi Plaza33,768588501,2020-09-03 00:00:00,September 2020,995hcg,1 review,5,Wife’s bday,"Warm service with best food in town,will surely come back again for family dining,friendly staffs...."
Kampachi Plaza33,768431973,2020-09-02 00:00:00,September 2020,E6518NCamyl,1 review,5,Excellent Service & Friendly Staffs,"Went to Jaya Grocer before coming here and the staff helped me to keep them in their kitchen fridge! Didn't expect this kind of service👏👏👏

Had a great birthday celebration as well with good services!🥳🥳🥳"
Kampachi Plaza33,768256889,2020-09-01 00:00:00,September 2020,Shamu060497,1 review,5,Great Food,The sashimi was delicious! And the service was excellent! The tea was constantly refilled! Warm towels were a nice gesture!
Kampachi Plaza33,767844573,2020-08-30 00:00:00,August 2020,Jow1981,1 review,5,Best Japanese buffet for over 20yrs,Good service and food quality. Standard is maintained for the past 20yrs. Good for family and friend gathering
Kampachi Plaza33,766996673,2020-08-25 00:00:00,August 2020,Mohd H,23 reviews,1,Food is expensive and caused me and my whole family to have diarrhoea,"My honest advice. Don’t visit this branch. I spend over 650 ringgit last night only to cone back and suffer from acute stomach complications. I thought it was only me but when i asked my kids today, the too suffered acute stomach discomfort. What a..."
Kampachi Plaza33,766750258,2020-08-24 00:00:00,August 2020,MeviinnMah,1 review,5,My first visits here,"Celebrated my wife’s birthday with my friends here, the services and food is awesome! And the environment is comfortable"
Kampachi Plaza33,766486759,2020-08-23 00:00:00,August 2020,Maps799428,1 review,5,Buffet,"During our dine in, Mirwan recommended their specialty dish that made our lunch experience even more enjoyable with family. The food is fresh and delicious with great quality, wonderful friendly staff, nice arrangement and hospitality."
Kampachi Plaza33,766475037,2020-08-23 00:00:00,June 2020,Adrian Y,44 reviews,5,Excellent food and service,Both the food and service was excellent as always. Well worth the price. It was all very fresh and delicious.
Kampachi Plaza33,763185513,2020-08-05 00:00:00,August 2020,Vermilion_20,1 review,5,An honorable experience,This is a very good restaurant with excellent customer services. I truly felt like I was in Japan.It is the best place for birthday or business dinner. I will come to this restaurant again with my friends and other occasion
Kampachi Plaza33,762121633,2020-07-29 00:00:00,July 2020,Jonnybrav000,1 review,5,John,"Nice and cozy environment. Nice food, Excellence service, friendly staff👍 abit pricey for some item"
Kampachi Plaza33,762097683,2020-07-29 00:00:00,July 2020,JaredNg,1 review,5,Efficient Service,"I was there last week with my friends for a dinner. The services provided was excellent, and the staffs were helpful in fulfilling my request. Value for money for such ambience."
Kampachi Plaza33,762086575,2020-07-29 00:00:00,July 2020,A_Azroy28,1 review,5,Best fish head,"had a date with my wife at this restaurant....we wanted to have some fresh seafood...the staff recommended a fish head....""Kampachi kama"" if im not mistaken...very fresh indeed...fell in love with 1 taste....will come back for more...thank you for friendly service...we had a really good time"
Kampachi Plaza33,760502073,2020-07-18 00:00:00,July 2020,HsienK7,2 reviews,5,Very good and friendly service,I came here for a family's member birthday celebration. It was a delightful gastronomic experience with exceptionally good service by the team!
Kampachi Plaza33,760501592,2020-07-18 00:00:00,July 2020,ginhere,1 review,5,Delicious food! Salmon sashimi,"Delicious food! Salmon sashimi & momo (peach) 🍑 was highlight of the day.
Excellent service provided by Izan & his team. 💯
Great ambience with authentic Japanese music playing. 🇯🇵"
Kampachi Plaza33,759897040,2020-07-13 00:00:00,July 2020,Jessiehtm,1 review,5,Sunday brunch,Received great service from the manager during our dining.. nice food served and great choices..good hygiene practice in the restaurant..will surely visit again..
Kampachi Plaza33,759895934,2020-07-13 00:00:00,July 2020,Penny W,3 reviews,5,Sunday Brunch,Variety of food serve and during this RMCO period their serving style different from previous. Good arrangements on it. Great service from the team and the manager as well. Will recommend more to come.
Kampachi Plaza33,759891681,2020-07-13 00:00:00,July 2020,miemie68,1 review,5,Good experiance,good food good service..all the servers are friendly made us feel welcome...staff recommended a few dishes and it all turn out very yummy...time taken for the food to be serve also not that long...food presentation was top notch....would love to come back...
Kampachi Plaza33,759100610,2020-07-06 00:00:00,July 2020,CathMY123,1 review,5,Nice view nice dine in restaurant,"The food served are nice n fresh. Superb service by the staffs here especially the manager,very cheerful and smilling all the times...
Had a wonderful birthday dinner here."
